{
  "schema": "ucc.handback",
  "schema_version": 1,
  "id": "hb_01K0A6R4V8W6E3M4M8Y0R9J2QH",
  "created_at": "2026-08-22T12:05:00.000Z",
  "created_by": "act_01K0A6R4V8W6E3M4M8Y0R9J2QA",
  "record_version": 1,
  "execution_id": "exec_01K0A6R4V8W6E3M4M8Y0R9J2QE",
  "node_id": "node_01K0A6R4V8W6E3M4M8Y0R9J2QX",
  "handback_phase": "collected",
  "manifest_hash": "sha256:0123456789abcdef0123456789abcdef0123456789abcdef0123456789abcdef",
  "outputs_hash": "sha256:0123456789abcdef0123456789abcdef0123456789abcdef0123456789abcdef",
  "collected_paths": [
    "outputs/results.json",
    "outputs/stdout.log"
  ],
  "committed_at": "2026-08-22T12:04:00.000Z",
  "collected_at": "2026-08-22T12:05:00.000Z"
}
